{
  "schema_version": "companion.task.v1",
  "task_id": "task-workflow-001",
  "task_revision": 0,
  "kind": "companion.workflow",
  "mode": "orchestration",
  "scope": {
    "ecosystem_id": "ecosystem-001",
    "installation_id": "installation-001",
    "runtime_instance_id": "embedded-runtime",
    "host_kind": "companion-app",
    "bot_id": "bot-main",
    "platform": null,
    "account_id": null,
    "conversation_ref": "conversation-001",
    "platform_conversation_id": null,
    "session_id": null,
    "user_id": null,
    "group_id": null,
    "persona_id": "persona-main",
    "persona_binding_revision": 12
  },
  "owner_ref": "workflow-owner",
  "supervisor_generation": "supervisor-8",
  "binding": null,
  "parent_task_id": null,
  "source_event_ref": {
    "kind": "companion.event",
    "ref": "event-story-request",
    "revision": 1
  },
  "session_id": null,
  "operation_id": null,
  "idempotency_key": null,
  "side_effect": "none",
  "state": "created",
  "attempt_id": null,
  "attempt_no": 0,
  "occurrence": null,
  "next_run_at": null,
  "deadline_at": "2026-09-08T02:05:00Z",
  "budget_ref": "budget-workflow-001",
  "wait": null,
  "retry": null,
  "checkpoint_ref": null,
  "result_ref": null,
  "cancellation_reason": null,
  "last_error": null
}
